title,url
 Beyond the Basic Stuff with Python: Writing Clean Code,https://freecomputerbooks.com/Beyond-the-Basic-Stuff-with-Python-Best-Practices-for-Writing-Clean-Code.html
" Python Packages (Tomas Beuzen, et al.)",https://freecomputerbooks.com/Python-Packages.html
" Deep Learning with Python, 2nd Edition (Francois Chollet)",https://freecomputerbooks.com/Deep-Learning-with-Python.htm
" Architecture Patterns with Python (Harry Percival, et al.)",https://freecomputerbooks.com/Architecture-Patterns-with-Python.html
 Clean Architectures in Python: Better Software Design,https://freecomputerbooks.com/Clean-Architectures-in-Python.html
 Automate the Boring Stuff with Python (Albert Sweigart),https://freecomputerbooks.com/Automate-the-Boring-Stuff-with-Python.html
 Python for Everybody: Exploring Data in Python 3,https://freecomputerbooks.com/Python-for-Everybody-Exploring-Data%20in-Python-3.html
 Problem Solving with Algorithms/Data Structures using Python,https://freecomputerbooks.com/Problem-Solving-with-Algorithms-and-Data-Structures-Using-Python.html
 Fundamentals of Python Programming (Richard L. Halterman),https://freecomputerbooks.com/Fundamentals-of-Python-Programming-by-Richard-Halterman.html
" O'Reilly® Think Python, 2nd Edition (Allen B. Downey)",https://freecomputerbooks.com/Think-Python-2nd-Edition.html
 The Big Book of Small Python Projects: 81 Easy Practice Programs,https://freecomputerbooks.com/The-Big-Book-of-Small-Python-Projects.html
 Practical Python Projects (Yasoob Khalid),https://freecomputerbooks.com/Practical-Python-Projects.html
" Python Programming Exercises, Gently Explained (Al Sweigart)",https://freecomputerbooks.com/Python-Programming-Exercises-Gently-Explained.html
 Functional Programming in Python (David Mertz),https://freecomputerbooks.com/Functional-Programming-in-Python.html
" Python 3 Patterns, Recipes and Idioms (Bruce Eckel, et al)",https://freecomputerbooks.com/Python-3-Patterns-Recipes-and-Idioms.html
 The Recursive Book of Recursion using Python (Al Sweigart),https://freecomputerbooks.com/The-Recursive-Book-of-Recursion-Ace-the-Coding-Interview-with-Python-and-JavaScript.html
 O'Reilly® Python Data Science Handbook: Essential Tools,https://freecomputerbooks.com/Python-Data-Science-Handbook.html
 Modeling and Simulation in Python (Allen B. Downey),https://freecomputerbooks.com/Modeling-and-Simulation-in-Python.html
 Introduction to Scientific Programming with Python,https://freecomputerbooks.com/Introduction-to-Scientific-Programming-with-Python.html
 Python for Network Engineers (Natasha Samoylenko),https://freecomputerbooks.com/Python-for-Network-Engineers.html
 Programming for Computations - Python 3 Edition,https://freecomputerbooks.com/Programming-for-Computations-Python-3.6.html
 Computational Physics with Python (Eric Ayars),https://freecomputerbooks.com/Computational-Physics-with-Python-by-Eric-Ayars.html
 Python Design Patterns (Brandon Rhodes),https://freecomputerbooks.com/Python-Design-Patterns.html
 O'Reilly® 20 Python Libraries You Aren't Using (But Should),https://freecomputerbooks.com/20-Python-Libraries%20You-Are-Not-Using-But-Should.html
 O'Reilly® Think Bayes: Bayesian Statistics in Python,https://freecomputerbooks.com/Think-Bayes-Bayesian-Statistics-Made-Simple.html
 How To Code in Python 3 (Lisa Tagliaferri),https://freecomputerbooks.com/How-To-Code-in-Python-3.html
 Python Tutorial (Guido van Rossum),https://freecomputerbooks.com/Python-Tutorial-by-Guido-van-Rossum.html
 How to Think Like a Computer Scientist: Learning with Python 3,https://freecomputerbooks.com/How-to-Think-Like-a-Computer-Scientist-Learning-with-Python.html
 The Coder's Apprentice: Learning Programming with Python 3,https://freecomputerbooks.com/The-Coders-Apprentice-Learning-Programming-with-Python-3.html
 Code Like a Pythonista: Idiomatic Python (David Goodger),https://freecomputerbooks.com/Code-Like-a-Pythonista-Idiomatic-Python.html
 Learn More Python 3 The Hard Way (Zed A. Shaw),https://freecomputerbooks.com/Learn-Python-The-Hard-Way.html
" Create Graphical User Interfaces with Python (Laura Sach, et al)",https://freecomputerbooks.com/Create-Graphical-User-Interfaces-with-Python.html
 Foundations of Robotics: Approach with Python and ROS,https://freecomputerbooks.com/Foundations-of-Robotics-Approach-with-Python-and-ROS.html
 O'Reilly® Think DSP: Digital Signal Processing in Python,https://freecomputerbooks.com/Think-DSP-Digital-Signal-Processing-in-Python.html
 PySDR: A Guide to SDR and DSP using Python (Marc Lichtman),https://freecomputerbooks.com/PySDR-A-Guide-to-SDR-and-DSP-using-Python.html
 Kalman and Bayesian Filters in Python (Roger R Labbe Jr.),https://freecomputerbooks.com/Kalman-and-Bayesian-Filters-in-Python.html
 Python for Geospatial Analysis (Ujaval Gandhi),https://freecomputerbooks.com/Geospatial-Analysis-with-Python.html
" Python Scripting for Spatial Data Processing (Pete Bunting, et al)",https://freecomputerbooks.com/Python-Scripting-for-Spatial-Data-Processing.html
 Learning Python (Fabrizio Romano),https://freecomputerbooks.com/Learning-Python-by-Fabrizio-Romano.html
 Mining Social Media using Python: Finding Stories in Data,https://freecomputerbooks.com/Mining-Social-Media-Finding-Stories-in-Internet-Data.html
" Python Machine Learning Projects (Brian Boucheron, et al)",https://freecomputerbooks.com/Python-Machine-Learning-Projects.html
" Deep Learning with PyTorch (Eli Stevens, et al)",https://freecomputerbooks.com/Deep-Learning-with-PyTorch.html
 Machine Learning with TensorFlow (Nishant Shukla),https://freecomputerbooks.com/Machine-Learning-with-TensorFlow.html
 Elements of Data Science using Python (Allen B. Downey),https://freecomputerbooks.com/Elements-of-Data-Science.html
" Biopython Tutorial and Cookbook (Jeff Chang, et al)",https://freecomputerbooks.com/Biopython-Tutorial-and-Cookbook.html
 Building Skills in Object-Oriented Design in Python,https://freecomputerbooks.com/Building-Skills-in-Object-Oriented-Design.html
 Program Arcade Games: With Python and Pygame (Paul Craven),https://freecomputerbooks.com/Program-Arcade-Games-with-Python-and-Pygame.html
 Coding Games With Pygame Zero and Python (Richard Smith),https://freecomputerbooks.com/Coding-Games-With-Pygame-Zero-and-Python.html
 Code the Classics – Volume 1: Using Python and Pygame,https://freecomputerbooks.com/Code-the-Classics-Volume-1.html
 Learning Computing with Robots using Python (Deepak Kumar),https://freecomputerbooks.com/Learning-Computing-with-Robots.html
 Classic Computer Science Problems in Python (David Kopec),https://freecomputerbooks.com/Classic-Computer-Science-Problems-in-Python.html
 CS for All: An Introduction to Computer Science using Python,https://freecomputerbooks.com/CS-for-All.html
 Practices of the Python Pro (Dane Hillard),https://freecomputerbooks.com/Practices-of-the-Python-Pro.html
 IPython Interactive Computing and Visualization Cookbook,https://freecomputerbooks.com/IPython-Interactive-Computing-and-Visualization-Cookbook.html
 A Whirlwind Tour of Python (Jake VanderPlas),https://freecomputerbooks.com/A-Whirlwind-Tour-of-Python.html
" Learn Python, Break Python: A Beginner's Guide to Programming",https://freecomputerbooks.com/Learn-Python-Break-Python.html
 Annotated Algorithms in Python: with Applications,https://freecomputerbooks.com/Annotated-Algorithms-in-Python-with-Applications-in-Physics-Biology-and-Finance.html
 O'Reilly® Test-Driven Development with Python (Harry Percival),https://freecomputerbooks.com/Test-Driven-Development-with-Python.html
" Non-Programmer's Tutorial for Python 3 (Josh Cogliati, et al)",https://freecomputerbooks.com/Non-Programmers-Tutorial-for-Python-3.html
 The Hitchhiker's Guide to Python: Best Practices for Development,https://freecomputerbooks.com/The-Hitchhikers-Guide-to-Python.html
 Cracking Codes with Python: Building and Breaking Ciphers,https://freecomputerbooks.com/Cracking-Codes-with-Python.html
 Open Workbook of Cryptology: Python Projects,https://freecomputerbooks.com/Open-Workbook-of-Cryptology.html
 Python and Coding Theory (David Joyner),https://freecomputerbooks.com/Python-and-Coding-Theory.html
 Hands-on Python Tutorial (Dr. Andrew N. Harrington),https://freecomputerbooks.com/Hands-on-Python-Tutorial-by-Andrew-N-Harrington.html
 Essential Python (Krzysztof Kowalczyk),https://freecomputerbooks.com/Essential-Python.html
 O'Reilly® Python Web Frameworks (Carlos De La Guardia),https://freecomputerbooks.com/Python-Web-Frameworks.html
" Hadoop with Python (Zachary Radtka, et al)",https://freecomputerbooks.com/Hadoop-with-Python.html
 Python Notes for Professionals (Stack Overflow Contributors),https://freecomputerbooks.com/Python-Notes-for-Professionals.html
 How to Make Mistakes in Python? (Mike Pirnat),https://freecomputerbooks.com/How-to-Make-Mistakes-in-Python.html
 Fast Lane to Python (Norm Matloff),https://freecomputerbooks.com/Fas-Lane-to-Python.html
 A Beginner's Python Tutorial (Wikibooks),https://freecomputerbooks.com/A-Beginners-Python-Tutorial-Wikibooks.html
" Programming for Computations - Python (Svein Linge, et al)",https://freecomputerbooks.com/Programming-for-Computations-Python.html
 Solving PDEs in Python: The FEniCS Tutorial I (H. Langtangen),https://freecomputerbooks.com/Solving-PDEs-in-Python.html
 Developing Graphics Frameworks with Python and OpenGL,https://freecomputerbooks.com/Developing-Graphics-Frameworks-with-Python-and-OpenGL.html
 Python and OpenGL for Scientific Visualization (Nicolas P. Rougier),https://freecomputerbooks.com/Python-and-OpenGL-for-Scientific-Visualization.html
 Scientific Visualisation: Python and Matplotlib (Nicolas P. Rougier),https://freecomputerbooks.com/Scientific-Visualisation-Python-and-Matplotlib.html
 From Python to NumPy (Nicolas P. Rougier),https://freecomputerbooks.com/From-Python-to-Numpy.html
 Guide to NumPy (Travis E. Oliphant),https://freecomputerbooks.com/Guide-to-NumPy.html
" NumPy Tutorials (Usman Malik, Anne Bonner, et al)",https://freecomputerbooks.com/NumPy-Tutorials.html
" Scipy Lecture Notes (Emmanuelle Gouillart, et al)",https://freecomputerbooks.com/Scipy-Lecture-Notes.html
 SciPy Programming Succinctly (James McCaffrey),https://freecomputerbooks.com/SciPy-Programming-Succinctly.html
 Bayesian Methods for Hackers: Using Python and PyMC,https://freecomputerbooks.com/Bayesian-Methods-for-Hackers.html
 O'Reilly® Picking a Python Version: A Manifesto (David Mertz),https://freecomputerbooks.com/Picking-a-Python-Version-A-Manifesto.html
 Dive Into Python 3 (Mark Pilgrim),https://freecomputerbooks.com/Dive-Into-Python-3.html
 Porting to Python 3: An In-depth Guide (Lennart Regebro),https://freecomputerbooks.com/Porting-to-Python3.html
" Python Scripting for Spatial Data Processing (Pete Bunting, et al)",https://freecomputerbooks.com/Python-Scripting-for-Spatial-Data-Processing.html
 Python 3 Basics Tutorial (Kristian Rother),https://freecomputerbooks.com/Python-3-Basics-Tutorial.html
 Modeling Creativity - Case Studies in Python (Tom De Smedt),https://freecomputerbooks.com/Modeling-Creativity-Case-Studies-in-Python.html
 Python 201: (Slightly) Advanced Python Topics (Dave Kuhlman),https://freecomputerbooks.com/Python-201.html
 Python for Informatics: Exploring Information (Charles Severance),https://freecomputerbooks.com/Python-for-Informatics-Exploring-Information.html
 Algorithmic Problem Solving with Python (John B. Schneider),https://freecomputerbooks.com/Algorithmic-Problem-Solving-with-Python.html
" Python for Econometrics, Statistics and Data Analysis",https://freecomputerbooks.com/Introduction-to-Python-for-Econometrics-Statistics-and-Numerical-Analysis.html
 The Full Stack Python (Matt Makai),https://freecomputerbooks.com/The-Full-Stack-Python.html
 O'Reilly® Natural Language Processing with Python,https://freecomputerbooks.com/Natural-Language-Processing-with-Python.html
 Hands-On Natural Language Processing with Python,https://freecomputerbooks.com/Hands-On-Natural-Language-Processing-with-Python.html
" Think Stats, 2nd Edition: Exploratory Data Analysis in Python",https://freecomputerbooks.com/Think-Stats-2nd-Edition.html
 Gui Programming With Python: Using the Qt Toolkit (B. Rempt),https://freecomputerbooks.com/Gui-Programming-With-Python-Using-the-Qt-Toolkit.html
 Deep Learning Tutorials using Python (LISA Lab),https://freecomputerbooks.com/Deep-Learning-Tutorial.html
 Python for Kids: A Playful Introduction to Programming,https://freecomputerbooks.com/Python-for-Kids.html
 Hacking Secret Ciphers with Python (Albert Sweigart),https://freecomputerbooks.com/Hacking-Secret-Ciphers-with-Python.html
 Think Python - How to Think Like a Computer Scientist,https://freecomputerbooks.com/Think-Python-How-to-Think-Like-a-Computer-Scientist.html
 Open Data Structures: An Introduction using Python (Pat Morin),https://freecomputerbooks.com/Open-Data-Structures-An-Introduction.html
 Programming Computer Vision with Python: Tools and Algorithms,https://freecomputerbooks.com/Programming-Computer-Vision-with-Python.html
" Invent Your Own Computer Games with Python, 3rd Edition",https://freecomputerbooks.com/Invent-Your-Own-Computer-Games-with-Python.html
" Learn to Program Using Python: A Tutorial for Hobbyists, Starters",https://freecomputerbooks.com/Learn-to-Program-Using-Python.html
 Introduction to Python for Computational Science and Engineering,https://freecomputerbooks.com/Introduction-to-Python-for-Computational-Science-and-Engineering.html
 Python Scripting for Computational Science (Hans Langtangen),https://freecomputerbooks.com/Python-Scripting-for-Computational-Science.html
 Python Succinctly (Jason Cannon),https://freecomputerbooks.com/Python-Succinctly.html
" The Python Language Reference Manual (Guido van Rossum, et al)",https://freecomputerbooks.com/The-Python-Language-Reference-Manual-Guido-van-Rossum.html
" JavaScript Frameworks/Libraries (React.js, Angular, Node.js, etc.)",https://freecomputerbooks.com/webJavaScriptFrameworksBooks.html
 JavaScript for Impatient Programmers (Axel Rauschmayer),https://freecomputerbooks.com/JavaScript-for-Impatient-Programmers.html
" Eloquent JavaScript, 3rd Edition: A Modern Introduction",https://freecomputerbooks.com/Eloquent-JavaScript.html
 Make Games with Python on Raspberry Pi (Sean M. Tracey),https://freecomputerbooks.com/Make-Games-with-Python-on-Raspberry-Pi.html
" O'Reilly® Mining the Social Web, 2nd Edition (Matthew A. Russell)",https://freecomputerbooks.com/Mining-the-Social-Web.html
 O'Reilly® Think Stats: Probability and Statistics using Python,https://freecomputerbooks.com/Think-Stats-Probability-and-Statistics-for-Programmers.html
 O'Reilly® The Python Standard Library (Fredrik Lundh),https://freecomputerbooks.com/The-Python-Standard-Library.html
 Learning to Program Using Python (Cody Jackson),https://freecomputerbooks.com/Learning-to-Program-Using-Python-by-Cody-Jackson.html
 Programming and Mathematical Thinking: Discrete Math & Python,https://freecomputerbooks.com/Programming-and-Mathematical-Thinking.html
 Keras Succinctly (James McCaffrey),https://freecomputerbooks.com/Keras-Succinctly.html
 Dive Into Python: Python from Novice to Pro (Mark Pilgrim),https://freecomputerbooks.com/Dive-Into-Python.html
 A Byte of Python (Swaroop C H),https://freecomputerbooks.com/A-Byte-of-Python.html
 A Python Book (Dave Kuhlman),https://freecomputerbooks.com/A-Python-Book-by-Dave-Kuhlman.html
 Text Processing in Python (David Mertz),https://freecomputerbooks.com/Text-Processing-in-Python.html
 Making Games with Python and Pygame (Albert Sweigart),https://freecomputerbooks.com/Making-Games-with-Python-and-Pygame.html
 Effective Django (Nathan Yergler),https://freecomputerbooks.com/Effective-Django.html
 The Definitive Guide to Django: Web Development Done Right,https://freecomputerbooks.com/The-Django-Book.html
 O'Reilly® Think Complexity: Science and Modeling (Allen Downey),https://freecomputerbooks.com/Think-Complexity-Complexity-Science-and-Computational-Modeling.html
 Computational Physics with Python (Mark Newman),https://freecomputerbooks.com/Computational-Physics-with-Python.html
 Python Scientific Lecture Notes (Scipy Lectures ),https://freecomputerbooks.com/Python-Scientific-Lecture-Notes.html
" Inventory Analytics: A Practicable, Python-Driven Approach",https://freecomputerbooks.com/Inventory-Analytics.html
 Python in Hydrology (Sat Kumar Tomer),https://freecomputerbooks.com/Python-in-Hydrology.html
 How To Write Your Own Software Using Python (Steven F. Lott),https://freecomputerbooks.com/How-To-Write-Your-Own-Software-Using-Python.html
 First Course in Programming with Karel the Robot and Python,https://freecomputerbooks.com/First-Course-in-Programming-with-Karel-the-Robot-and-Python.html
 Basic Data Analysis and More - A Guided Tour Using Python,https://freecomputerbooks.com/Basic-Data-Analysis-and-More-A-Guided-Tour-Using-Python.html
 Become a Code Breaker with Python: a Beginner's Guide,https://freecomputerbooks.com/Become-Code-Breaker-Python.html
" The Art and Craft of Programming, Python Edition (John C. Lusth)",https://freecomputerbooks.com/The-Art-and-Craft-of-Programming-Python-Edition.html
 Learning with Python: Interactive Edition,https://freecomputerbooks.com/Learning-with-Python-How-to-Think-Like-a-Computer-Scientist.html
 Learning to Program with Python (Richard L. Halterman),https://freecomputerbooks.com/Learning-to-Program-with-Python.html
" Design Patterns in Python (Alexander Shvets, et al)",https://freecomputerbooks.com/Design-Patterns-in-Python.html
" O'Reilly® Python Cookbook, 3rd Ed: Recipes for Mastering Python 3",https://freecomputerbooks.com/Python-Cookbook.html
 Building Skills in Python: A Programmer's Introduction to Python,https://freecomputerbooks.com/Building-Skills-in-Python.html
" Fundamentals of Programming: With OOP, Python Edition",https://freecomputerbooks.com/Fundamentals-of-Programming-With-Object-Orientated-Programming.html
 The Definitive Guide to Pylons (James Gardner),https://freecomputerbooks.com/The-Definitive-Guide-to-Pylons.html
 Data Structures and Algorithms with OPP Design Patterns in Python,https://freecomputerbooks.com/Data-Structures-and-Algorithms-with-Object-Oriented-Design-Patterns-in-Python.html
 Start Here: Python Programming for Beginners (Jody S. Ginther),https://freecomputerbooks.com/Python-Programming-for-Beginners.html
